{
  "$schema": "https://json-schema.org/draft/2020-12/schema",
  "title": "Isaac API catalog entry",
  "type": "object",
  "required": ["id", "kind", "signature", "variants"],
  "properties": {
    "id": {"type": "string"},
    "kind": {"type": "string"},
    "signature": {"type": "string"},
    "variants": {"type": "array", "minItems": 1}
  }
}
